Title,Price,Availability,Rating,Price_Category,Sentiment
A Study in Scarlet (Sherlock Holmes #1),16.73,In stock,2,Low,Neutral
"A Series of Catastrophes and Miracles: A True Story of Love, Science, and Cancer",56.48,In stock,2,High,Positive
A People's History of the United States,40.79,In stock,2,High,Neutral
A Man Called Ove,39.72,In stock,1,Medium,Neutral
A Distant Mirror: The Calamitous 14th Century,14.58,In stock,3,Low,Negative
A Brush of Wings (Angels Walking #3),55.51,In stock,1,High,Neutral
1491: New Revelations of the Americas Before Columbus,21.8,In stock,3,Medium,Positive
"The Three Searches, Meaning, and the Story",13.33,In stock,3,Low,Neutral
Searching for Meaning in Gailana,38.73,In stock,1,Medium,Neutral
Rook,37.86,In stock,4,Medium,Neutral
My Kitchen Year: 136 Recipes That Saved My Life,11.53,In stock,2,Low,Neutral
13 Hours: The Inside Account of What Really Happened In Benghazi,27.06,In stock,1,Medium,Positive
Will You Won't You Want Me?,13.86,In stock,3,Low,Neutral
Tipping Point for Planet Earth: How Close Are We to the Edge?,37.55,In stock,1,Medium,Neutral
The Star-Touched Queen,32.3,In stock,5,Medium,Neutral
The Silent Sister (Riley MacPherson #1),46.29,In stock,5,High,Neutral
The Midnight Watch: A Novel of the Titanic and the Californian,26.2,In stock,1,Medium,Neutral
The Lonely City: Adventures in the Art of Being Alone,33.26,In stock,2,Medium,Negative
The Gray Rhino: How to Recognize and Act on the Obvious Dangers We Ignore,59.15,In stock,4,High,Neutral
The Golden Condom: And Other Essays on Love Lost and Found,39.43,In stock,1,Medium,Positive
The Epidemic (The Program 0.6),14.44,In stock,5,Low,Neutral
The Dinner Party,56.54,In stock,2,High,Neutral
The Diary of a Young Girl,59.9,In stock,3,High,Positive
The Children,11.88,In stock,3,Low,Neutral
Stars Above (The Lunar Chronicles #4.5),48.05,In stock,2,High,Neutral
Snatched: How A Drug Queen Went Undercover for the DEA and Was Kidnapped By Colombian Guerillas,21.21,In stock,3,Medium,Neutral
Raspberry Pi Electronics Projects for the Evil Genius,49.67,In stock,4,High,Negative
Quench Your Own Thirst: Business Lessons Learned Over a Beer or Two,43.14,In stock,1,High,Positive
Psycho: Sanitarium (Psycho #1.5),36.97,In stock,5,Medium,Neutral
Poisonous (Max Revere Novels #3),26.8,In stock,3,Medium,Neutral
One with You (Crossfire #5),15.71,In stock,4,Low,Neutral
No Love Allowed (Dodge Cove #1),54.65,In stock,4,High,Negative
Murder at the 42nd Street Library (Raymond Ambler #1),54.36,In stock,4,High,Neutral
Most Wanted,35.28,In stock,3,Medium,Positive
"Love, Lies and Spies",20.55,In stock,2,Medium,Positive
How to Speak Golf: An Illustrated Guide to Links Lingo,58.32,In stock,5,High,Neutral
Hide Away (Eve Duncan #20),11.84,In stock,1,Low,Neutral
Furiously Happy: A Funny Book About Horrible Things,41.46,In stock,4,High,Positive
Everyday Italian: 125 Simple and Delicious Recipes,20.1,In stock,5,Medium,Positive
Equal Is Unfair: America's Misguided Fight Against Income Inequality,56.86,In stock,1,High,Negative
Eleanor & Park,56.51,In stock,5,High,Neutral
Dirty (Dive Bar #1),40.83,In stock,4,High,Negative
Can You Keep a Secret? (Fear Street Relaunch #4),48.64,In stock,1,High,Negative
Boar Island (Anna Pigeon #19),59.48,In stock,3,High,Neutral
A Paris Apartment,39.01,In stock,4,Medium,Neutral
"A la Mode: 120 Recipes in 60 Pairings: Pies, Tarts, Cakes, Crisps, and More Topped with Ice Cream, Gelato, Frozen Custard, and More",38.77,In stock,1,Medium,Positive
Troublemaker: Surviving Hollywood and Scientology,48.39,In stock,2,High,Neutral
The Widow,27.26,In stock,2,Medium,Neutral
"The Sleep Revolution: Transforming Your Life, One Night at a Time",11.68,In stock,4,Low,Neutral
The Improbability of Love,59.45,In stock,1,High,Positive
The Art of Startup Fundraising,21.0,In stock,3,Medium,Neutral
Take Me Home Tonight (Rock Star Romance #3),53.98,In stock,3,High,Neutral
Sleeping Giants (Themis Files #1),48.74,In stock,1,High,Neutral
"Setting the World on Fire: The Brief, Astonishing Life of St. Catherine of Siena",21.15,In stock,2,Medium,Positive
Playing with Fire,13.71,In stock,3,Low,Neutral
Off the Hook (Fishing for Trouble #1),47.67,In stock,3,High,Negative
Mothering Sunday,13.34,In stock,2,Low,Neutral
"Mother, Can You Not?",16.89,In stock,5,Low,Neutral
M Train,27.18,In stock,1,Medium,Neutral
Lilac Girls,17.28,In stock,2,Low,Neutral
Lies and Other Acts of Love,45.14,In stock,1,High,Positive
Lab Girl,40.85,In stock,1,High,Neutral
Keep Me Posted,20.46,In stock,4,Medium,Neutral
It Didn't Start with You: How Inherited Family Trauma Shapes Who We Are and How to End the Cycle,56.27,In stock,3,High,Neutral
Grey (Fifty Shades #4),48.49,In stock,4,High,Negative
"Exit, Pursued by a Bear",51.34,In stock,4,High,Neutral
Daredevils,16.34,In stock,3,Low,Neutral
Cravings: Recipes for What You Want to Eat,20.5,In stock,3,Medium,Neutral
Born for This: How to Find the Work You Were Meant to Do,21.59,In stock,5,Medium,Neutral
Arena,21.36,In stock,4,Medium,Neutral
Adultery,20.88,In stock,5,Medium,Neutral
A Mother's Reckoning: Living in the Aftermath of Tragedy,19.53,In stock,3,Low,Neutral
A Gentleman's Position (Society of Gentlemen #3),14.75,In stock,5,Low,Neutral
11/22/63,48.48,In stock,3,High,Neutral
"10% Happier: How I Tamed the Voice in My Head, Reduced Stress Without Losing My Edge, and Found Self-Help That Actually Works",24.57,In stock,2,Medium,Neutral
10-Day Green Smoothie Cleanse: Lose Up to 15 Pounds in 10 Days!,49.71,In stock,5,High,Negative
Without Shame,48.27,In stock,5,High,Neutral
Watchmen,58.05,In stock,4,High,Neutral
Unlimited Intuition Now,58.87,In stock,4,High,Neutral
Underlying Notes,11.82,In stock,2,Low,Neutral
The Shack,28.03,In stock,1,Medium,Neutral
The New Brand You: Your New Image Makes the Sale for You,44.05,In stock,5,High,Positive
"The Moosewood Cookbook: Recipes from Moosewood Restaurant, Ithaca, New York",12.34,In stock,4,Low,Positive
The Flowers Lied,16.68,In stock,2,Low,Neutral
"The Fabric of the Cosmos: Space, Time, and the Texture of Reality",55.91,In stock,1,High,Neutral
The Book of Mormon,24.57,In stock,3,Medium,Neutral
The Art and Science of Low Carbohydrate Living,52.98,In stock,5,High,Neutral
The Alien Club,54.4,In stock,1,High,Negative
Suzie Snowflake: One beautiful flake (a self-esteem story),54.81,In stock,5,High,Positive
Nap-a-Roo,25.08,In stock,1,Medium,Neutral
"NaNo What Now? Finding your editing process, revising your NaNoWriMo book and building a writing career through publishing and beyond",10.41,In stock,4,Low,Neutral
Modern Day Fables,47.44,In stock,2,High,Positive
If I Gave You God's Phone Number....: Searching for Spirituality in America,20.91,In stock,1,Medium,Neutral
"Fruits Basket, Vol. 9 (Fruits Basket #9)",33.95,In stock,4,Medium,Neutral
Dress Your Family in Corduroy and Denim,43.68,In stock,3,High,Neutral
Don't Forget Steven,33.23,In stock,1,Medium,Neutral
Chernobyl 01:23:40: The Incredible True Story of the World's Worst Nuclear Disaster,35.92,In stock,2,Medium,Positive
Art and Fear: Observations on the Perils (and Rewards) of Artmaking,48.63,In stock,4,High,Neutral
A Shard of Ice (The Black Symphony Saga #1),56.63,In stock,3,High,Negative
A Hero's Curse (The Unseen Chronicles #1),50.49,In stock,3,High,Neutral
23 Degrees South: A Tropical Tale of Changing Whether...,35.79,In stock,2,Medium,Neutral
"Zero to One: Notes on Startups, or How to Build the Future",34.06,In stock,3,Medium,Neutral
Why Not Me?,17.76,In stock,1,Low,Neutral
When Breath Becomes Air,39.36,In stock,2,Medium,Neutral
Vagabonding: An Uncommon Guide to the Art of Long-Term World Travel,36.94,In stock,2,Medium,Positive
The Unlikely Pilgrimage of Harold Fry (Harold Fry #1),43.62,In stock,5,High,Negative
The New Drawing on the Right Side of the Brain,43.02,In stock,3,High,Positive
"The Midnight Assassin: Panic, Scandal, and the Hunt for America's First Serial Killer",28.45,In stock,4,Medium,Positive
The Martian (The Martian #1),41.39,In stock,2,High,Neutral
The High Mountains of Portugal,51.15,In stock,1,High,Positive
The Grownup,35.88,In stock,1,Medium,Neutral
The E-Myth Revisited: Why Most Small Businesses Don't Work and What to Do About It,36.91,In stock,1,Medium,Positive
South of Sunshine,28.93,In stock,1,Medium,Neutral
Smarter Faster Better: The Secrets of Being Productive in Life and Business,38.89,In stock,5,Medium,Positive
Silence in the Dark (Logan Point #4),58.33,In stock,3,High,Negative
Shadows of the Past (Logan Point #1),39.67,In stock,5,Medium,Negative
Roller Girl,14.1,In stock,5,Low,Neutral
Rising Strong,21.82,In stock,3,Medium,Positive
Proofs of God: Classical Arguments from Tertullian to Barth,54.21,In stock,1,High,Neutral
Please Kill Me: The Uncensored Oral History of Punk,31.19,In stock,4,Medium,Neutral
Out of Print: City Lights Spotlight No. 14,53.64,In stock,5,High,Neutral
My Life Next Door (My Life Next Door ),36.39,In stock,5,Medium,Neutral
Miller's Valley,58.54,In stock,2,High,Neutral
Man's Search for Meaning,29.48,In stock,3,Medium,Neutral
"Love That Boy: What Two Presidents, Eight Road Trips, and My Son Taught Me About a Parent's Expectations",25.06,In stock,2,Medium,Positive
Living Forward: A Proven Plan to Stop Drifting and Get the Life You Want,12.55,In stock,3,Low,Neutral
Les Fleurs du Mal,29.04,In stock,5,Medium,Neutral
Left Behind (Left Behind #1),40.72,In stock,2,High,Negative
Kill 'Em and Leave: Searching for James Brown and the American Soul,45.05,In stock,5,High,Neutral
Kierkegaard: A Christian Missionary to Christians,47.13,In stock,1,High,Neutral
John Vassos: Industrial Design for Modern Life,20.22,In stock,4,Medium,Positive
I'll Give You the Sun,56.48,In stock,1,High,Neutral
I Will Find You,44.21,In stock,1,High,Neutral
Hystopia: A Novel,21.96,In stock,4,Medium,Neutral
Howl and Other Poems,40.45,In stock,2,High,Negative
History of Beauty,10.29,In stock,4,Low,Neutral
Heaven is for Real: A Little Boy's Astounding Story of His Trip to Heaven and Back,52.86,In stock,2,High,Positive
Future Shock (Future Shock #1),55.65,In stock,5,High,Neutral
Ender's Game (The Ender Quintet #1),43.64,In stock,1,High,Negative
Diary of a Citizen Scientist: Chasing Tiger Beetles and Other New Ways of Engaging the World,28.41,In stock,1,Medium,Positive
Death by Leisure: A Cautionary Tale,37.51,In stock,4,Medium,Neutral
Brilliant Beacons: A History of the American Lighthouse,11.45,In stock,3,Low,Positive
Brazen: The Courage to Find the You That's Been Hiding,19.22,In stock,2,Low,Neutral
Between the World and Me,56.91,In stock,4,High,Neutral
Being Mortal: Medicine and What Matters in the End,55.06,In stock,4,High,Neutral
"A Murder Over a Girl: Justice, Gender, Junior High",13.2,In stock,3,Low,Positive
32 Yolks,53.63,In stock,2,High,Neutral
"""Most Blessed of the Patriarchs"": Thomas Jefferson and the Empire of the Imagination",44.48,In stock,5,High,Positive
You Are a Badass: How to Stop Doubting Your Greatness and Start Living an Awesome Life,12.08,In stock,3,Low,Positive
Wildlife of New York: A Five-Borough Coloring Book,22.14,In stock,2,Medium,Positive
What Happened on Beale Street (Secrets of the South Mysteries #2),25.37,In stock,5,Medium,Neutral
Unreasonable Hope: Finding Faith in the God Who Brings Purpose to Your Pain,46.33,In stock,2,High,Neutral
Under the Tuscan Sun,37.33,In stock,3,Medium,Neutral
Toddlers Are A**holes: It's Not Your Fault,25.55,In stock,1,Medium,Neutral
The Year of Living Biblically: One Man's Humble Quest to Follow the Bible as Literally as Possible,34.72,In stock,1,Medium,Negative
The Whale,35.96,In stock,4,Medium,Neutral
The Story of Art,41.14,In stock,4,High,Neutral
The Origin of Species,10.01,In stock,4,Low,Neutral
The Great Gatsby,36.05,In stock,4,Medium,Positive
The Good Girl,49.03,In stock,3,High,Positive
The Glass Castle,16.24,In stock,1,Low,Neutral
The Faith of Christopher Hitchens: The Restless Soul of the World's Most Notorious Atheist,39.55,In stock,1,Medium,Positive
The Drowning Girls,35.67,In stock,3,Medium,Neutral
The Constant Princess (The Tudor Court #1),16.62,In stock,3,Low,Neutral
The Bourne Identity (Jason Bourne #1),42.78,In stock,4,High,Neutral
The Bachelor Girl's Guide to Murder (Herringford and Watts Mysteries #1),52.3,In stock,5,High,Neutral
The Art Book,32.34,In stock,2,Medium,Neutral
The 7 Habits of Highly Effective People: Powerful Lessons in Personal Change,33.17,In stock,4,Medium,Positive
Team of Rivals: The Political Genius of Abraham Lincoln,20.12,In stock,5,Medium,Neutral
Steal Like an Artist: 10 Things Nobody Told You About Being Creative,20.9,In stock,2,Medium,Positive
"Sit, Stay, Love",20.9,In stock,3,Medium,Positive
Sister Dear,40.2,In stock,4,High,Neutral
"Shrunken Treasures: Literary Classics, Short, Sweet, and Silly",52.87,In stock,3,High,Negative
"Rich Dad, Poor Dad",51.74,In stock,1,High,Negative
Raymie Nightingale,34.41,In stock,2,Medium,Neutral
Playing from the Heart,32.38,In stock,1,Medium,Neutral
Nightstruck: A Novel,50.35,In stock,4,High,Neutral
"Naturally Lean: 125 Nourishing Gluten-Free, Plant-Based Recipes--All Under 300 Calories",11.38,In stock,5,Low,Positive
Meternity,43.58,In stock,3,High,Neutral
Memoirs of a Geisha,49.67,In stock,3,High,Neutral
Like Never Before (Walker Family #2),28.77,In stock,2,Medium,Neutral
Life of Pi,13.22,In stock,4,Low,Neutral
Leave This Song Behind: Teen Poetry at Its Best,51.17,In stock,5,High,Positive
King's Folly (The Kinsman Chronicles #1),39.61,In stock,5,Medium,Neutral
John Adams,57.43,In stock,4,High,Neutral
How to Cook Everything Vegetarian: Simple Meatless Recipes for Great Food (How to Cook Everything),46.01,In stock,4,High,Positive
How to Be a Domestic Goddess: Baking and the Art of Comfort Cooking,28.25,In stock,2,Medium,Neutral
Good in Bed (Cannie Shapiro #1),37.05,In stock,5,Medium,Positive
"Fruits Basket, Vol. 7 (Fruits Basket #7)",19.57,In stock,1,Low,Neutral
For the Love: Fighting for Grace in a World of Impossible Standards,45.13,In stock,3,High,Negative
Finding God in the Ruins: How God Redeems Pain,46.64,In stock,2,High,Negative
Every Heart a Doorway (Every Heart A Doorway #1),12.16,In stock,5,Low,Neutral
Delivering the Truth (Quaker Midwife Mystery #1),20.89,In stock,4,Medium,Neutral
Counted With the Stars (Out from Egypt #1),17.97,In stock,5,Low,Neutral
"Chronicles, Vol. 1",52.6,In stock,2,High,Neutral
Blue Like Jazz: Nonreligious Thoughts on Christian Spirituality,25.77,In stock,1,Medium,Neutral
Benjamin Franklin: An American Life,48.19,In stock,3,High,Neutral
"At The Existentialist Café: Freedom, Being, and apricot cocktails with: Jean-Paul Sartre, Simone de Beauvoir, Albert Camus, Martin Heidegger, Edmund Husserl, Karl Jaspers, Maurice Merleau-Ponty and others",29.93,In stock,5,Medium,Neutral
A Summer In Europe,44.34,In stock,2,High,Neutral
A Short History of Nearly Everything,52.4,In stock,5,High,Positive
A Gathering of Shadows (Shades of Magic #2),44.81,In stock,4,High,Positive
The Sound Of Love,57.84,In stock,5,High,Positive
The Rise and Fall of the Third Reich: A History of Nazi Germany,39.67,In stock,2,Medium,Neutral
The Perks of Being a Wallflower,55.02,In stock,3,High,Neutral
The Mysterious Affair at Styles (Hercule Poirot #1),24.8,In stock,4,Medium,Neutral
The Man Who Mistook His Wife for a Hat and Other Clinical Tales,59.45,In stock,4,High,Negative
The Makings of a Fatherless Child,31.58,In stock,2,Medium,Neutral
The Joy of Cooking,43.27,In stock,4,High,Positive
The Invention of Wings,37.34,In stock,1,Medium,Neutral
The Hobbit (Middle-Earth Universe),17.8,In stock,5,Low,Neutral
The Great Railway Bazaar,30.54,In stock,1,Medium,Positive
The Golden Compass (His Dark Materials #1),18.77,In stock,1,Low,Positive
The God Delusion,46.85,In stock,3,High,Neutral
The Girl You Left Behind (The Girl You Left Behind #1),15.79,In stock,1,Low,Negative
The Fellowship of the Ring (The Lord of the Rings #1),10.27,In stock,2,Low,Neutral
The Collected Poems of W.B. Yeats (The Collected Works of W.B. Yeats #1),15.42,In stock,5,Low,Neutral
The Barefoot Contessa Cookbook,59.92,In stock,5,High,Neutral
Tell the Wolves I'm Home,50.96,In stock,2,High,Neutral
Ship Leaves Harbor: Essays on Travel by a Recovering Journeyman,30.6,In stock,3,Medium,Neutral
Pride and Prejudice,19.27,In stock,4,Low,Neutral
Musicophilia: Tales of Music and the Brain,46.58,In stock,1,High,Neutral
Mere Christianity,48.51,In stock,3,High,Negative
Me Before You (Me Before You #1),19.02,In stock,1,Low,Neutral
In the Woods (Dublin Murder Squad #1),38.38,In stock,2,Medium,Neutral
In Cold Blood,49.98,In stock,4,High,Negative
How to Stop Worrying and Start Living,46.49,In stock,5,High,Neutral
Give It Back,18.32,In stock,2,Low,Neutral
"Girl, Interrupted",42.14,In stock,3,High,Neutral
Fun Home: A Family Tragicomic,56.59,In stock,4,High,Positive
"Fruits Basket, Vol. 6 (Fruits Basket #6)",20.96,In stock,4,Medium,Neutral
Deception Point,40.32,In stock,4,High,Neutral
"Death Note, Vol. 6: Give-and-Take (Death Note #6)",36.39,In stock,3,Medium,Neutral
Catherine the Great: Portrait of a Woman,58.55,In stock,4,High,Positive
Better Homes and Gardens New Cook Book,39.61,In stock,3,Medium,Positive
An Unquiet Mind: A Memoir of Moods and Madness,21.3,In stock,3,Medium,Neutral
A Year in Provence (Provence #1),56.88,In stock,4,High,Neutral
World Without End (The Pillars of the Earth #2),32.97,In stock,4,Medium,Neutral
"Will Grayson, Will Grayson (Will Grayson, Will Grayson)",47.31,In stock,4,High,Neutral
Why Save the Bankers?: And Other Essays on Our Economic and Political Crisis,48.67,In stock,2,High,Positive
Where She Went (If I Stay #2),41.73,In stock,4,High,Neutral
What If?: Serious Scientific Answers to Absurd Hypothetical Questions,53.68,In stock,4,High,Negative
Two Summers,14.64,In stock,1,Low,Neutral
This Is Your Brain on Music: The Science of a Human Obsession,38.4,In stock,1,Medium,Neutral
The Secret Garden,15.08,In stock,4,Low,Negative
The Raven King (The Raven Cycle #4),30.57,In stock,2,Medium,Neutral
The Raven Boys (The Raven Cycle #1),57.74,In stock,4,High,Neutral
The Power Greens Cookbook: 140 Delicious Superfood Recipes,11.05,In stock,5,Low,Positive
The Metamorphosis,28.58,In stock,1,Medium,Neutral
The Mathews Men: Seven Brothers and the War Against Hitler's U-boats,42.91,In stock,5,High,Neutral
The Little Paris Bookshop,24.73,In stock,3,Medium,Negative
The Hiding Place,55.91,In stock,4,High,Neutral
The Grand Design,13.76,In stock,3,Low,Positive
The Firm,45.56,In stock,3,High,Negative
The Fault in Our Stars,47.22,In stock,1,High,Neutral
The False Prince (The Ascendance Trilogy #1),56.0,In stock,5,High,Negative
The Expatriates,44.58,In stock,2,High,Neutral
The Dream Thieves (The Raven Cycle #2),34.5,In stock,1,Medium,Neutral
The Darkest Corners,11.33,In stock,5,Low,Neutral
The Crossover,38.77,In stock,4,Medium,Neutral
The 5th Wave (The 5th Wave #1),11.83,In stock,2,Low,Neutral
Tell the Wind and Fire,45.51,In stock,3,High,Neutral
Tell Me Three Things,41.81,In stock,1,High,Neutral
Talking to Girls About Duran Duran: One Young Man's Quest for True Love and a Cooler Haircut,25.15,In stock,4,Medium,Positive
Siddhartha,34.22,In stock,5,Medium,Neutral
Shiver (The Wolves of Mercy Falls #1),16.23,In stock,5,Low,Neutral
Remember Me?,11.48,In stock,3,Low,Neutral
Red Dragon (Hannibal Lecter #1),23.37,In stock,3,Medium,Neutral
Peak: Secrets from the New Science of Expertise,16.28,In stock,2,Low,Positive
My Mother Was Nuts,31.63,In stock,4,Medium,Neutral
Mexican Today: New and Rediscovered Recipes for Contemporary Kitchens,24.91,In stock,5,Medium,Positive
Maybe Something Beautiful: How Art Transformed a Neighborhood,22.54,In stock,1,Medium,Positive
Lola and the Boy Next Door (Anna and the French Kiss #2),23.63,In stock,4,Medium,Neutral
Logan Kade (Fallen Crest High #5.5),13.12,In stock,2,Low,Positive
Last One Home (New Beginnings #1),59.98,In stock,3,High,Positive
Killing Floor (Jack Reacher #1),31.49,In stock,4,Medium,Neutral
Kill the Boy Band,15.52,In stock,5,Low,Neutral
Isla and the Happily Ever After (Anna and the French Kiss #3),48.13,In stock,5,High,Positive
If I Stay (If I Stay #1),38.13,In stock,5,Medium,Neutral
I Know Why the Caged Bird Sings (Maya Angelou's Autobiography #1),36.55,In stock,2,Medium,Neutral
Harry Potter and the Deathly Hallows (Harry Potter #7),23.32,In stock,1,Medium,Neutral
"Fruits Basket, Vol. 5 (Fruits Basket #5)",16.33,In stock,1,Low,Neutral
Foundation (Foundation (Publication Order) #1),32.42,In stock,1,Medium,Neutral
Fool Me Once,16.96,In stock,1,Low,Neutral
Find Her (Detective D.D. Warren #8),22.37,In stock,1,Medium,Positive
Evicted: Poverty and Profit in the American City,42.27,In stock,1,High,Neutral
Drama,38.7,In stock,2,Medium,Neutral
Dracula the Un-Dead,35.63,In stock,5,Medium,Neutral
Digital Fortress,58.0,In stock,5,High,Neutral
"Death Note, Vol. 5: Whiteout (Death Note #5)",52.41,In stock,1,High,Neutral
"Data, A Love Story: How I Gamed Online Dating to Meet My Match",32.35,In stock,3,Medium,Positive
Critique of Pure Reason,20.75,In stock,1,Medium,Positive
Booked,17.49,In stock,5,Low,Neutral
"Blue Lily, Lily Blue (The Raven Cycle #3)",34.13,In stock,5,Medium,Neutral
Approval Junkie: Adventures in Caring Too Much,58.81,In stock,5,High,Positive
An Abundance of Katherines,10.0,In stock,5,Low,Neutral
America's War for the Greater Middle East: A Military History,51.22,In stock,2,High,Positive
Alight (The Generations Trilogy #2),58.59,In stock,4,High,Neutral
A Girl's Guide to Moving On (New Beginnings #2),31.3,In stock,1,Medium,Positive
A Game of Thrones (A Song of Ice and Fire #1),46.42,In stock,2,High,Negative
A Feast for Crows (A Song of Ice and Fire #4),17.21,In stock,4,Low,Neutral
A Clash of Kings (A Song of Ice and Fire #2),10.79,In stock,3,Low,Neutral
Vogue Colors A to Z: A Fashion Coloring Book,52.35,In stock,4,High,Neutral
The Shining (The Shining #1),27.88,In stock,3,Medium,Neutral
The Pilgrim's Progress,50.26,In stock,2,High,Neutral
The Perfect Play (Play by Play #1),59.99,In stock,3,High,Positive
The Passion of Dolssa,28.32,In stock,5,Medium,Neutral
The Jazz of Physics: The Secret Link Between Music and the Structure of the Universe,38.71,In stock,3,Medium,Negative
The Hunger Games (The Hunger Games #1),29.85,In stock,5,Medium,Neutral
The Hound of the Baskervilles (Sherlock Holmes #5),14.82,In stock,2,Low,Neutral
The Gunning of America: Business and the Making of American Gun Culture,16.81,In stock,4,Low,Neutral
The Geography of Bliss: One Grump's Search for the Happiest Places in the World,28.23,In stock,2,Medium,Neutral
The Demonists (Demonist #1),52.11,In stock,2,High,Neutral
"The Demon Prince of Momochi House, Vol. 4 (The Demon Prince of Momochi House #4)",27.88,In stock,2,Medium,Neutral
The Bone Hunters (Lexy Vaughan & Steven Macaulay #2),59.71,In stock,3,High,Neutral
The Beast (Black Dagger Brotherhood #14),46.08,In stock,5,High,Negative
Some Women,13.73,In stock,5,Low,Neutral
Shopaholic Ties the Knot (Shopaholic #3),48.39,In stock,5,High,Neutral
Paper and Fire (The Great Library #2),49.45,In stock,5,High,Positive
Outlander (Outlander #1),19.67,In stock,5,Low,Neutral
"Orchestra of Exiles: The Story of Bronislaw Huberman, the Israel Philharmonic, and the One Thousand Jews He Saved from Nazi Horrors",12.36,In stock,3,Low,Neutral
No One Here Gets Out Alive,20.02,In stock,5,Medium,Positive
Night Shift (Night Shift #1-20),12.75,In stock,4,Low,Neutral
Needful Things,47.51,In stock,4,High,Neutral
Mockingjay (The Hunger Games #3),20.44,In stock,4,Medium,Neutral
Misery,34.79,In stock,2,Medium,Neutral
Little Women (Little Women #1),28.07,In stock,4,Medium,Negative
It,25.01,In stock,3,Medium,Neutral
Harry Potter and the Sorcerer's Stone (Harry Potter #1),13.9,In stock,3,Low,Neutral
Harry Potter and the Prisoner of Azkaban (Harry Potter #3),24.17,In stock,4,Medium,Neutral
Harry Potter and the Order of the Phoenix (Harry Potter #5),31.63,In stock,4,Medium,Neutral
Harry Potter and the Half-Blood Prince (Harry Potter #6),48.75,In stock,5,High,Neutral
Harry Potter and the Chamber of Secrets (Harry Potter #2),14.74,In stock,1,Low,Neutral
Gone with the Wind,32.49,In stock,3,Medium,Neutral
God Is Not Great: How Religion Poisons Everything,27.8,In stock,1,Medium,Negative
Girl With a Pearl Earring,26.77,In stock,1,Medium,Neutral
"Fruits Basket, Vol. 4 (Fruits Basket #4)",50.44,In stock,4,High,Neutral
Far From True (Promise Falls Trilogy #2),34.93,In stock,2,Medium,Positive
Dark Lover (Black Dagger Brotherhood #1),12.87,In stock,1,Low,Negative
Confessions of a Shopaholic (Shopaholic #1),48.94,In stock,2,High,Neutral
Changing the Game (Play by Play #2),13.38,In stock,3,Low,Negative
Candide,58.63,In stock,3,High,Neutral
Can You Keep a Secret?,21.94,In stock,1,Medium,Negative
Atlas Shrugged,26.58,In stock,5,Medium,Neutral
Animal Farm,57.22,In stock,3,High,Neutral
A Walk to Remember,56.43,In stock,1,High,Neutral
A New Earth: Awakening to Your Life's Purpose,55.65,In stock,5,High,Positive
"A History of God: The 4,000-Year Quest of Judaism, Christianity, and Islam",27.62,In stock,1,Medium,Neutral
'Salem's Lot,49.56,In stock,4,High,Neutral
Zero History (Blue Ant #3),34.77,In stock,1,Medium,Neutral
Wuthering Heights,17.73,In stock,3,Low,Neutral
World War Z: An Oral History of the Zombie War,21.8,In stock,1,Medium,Neutral
Wild: From Lost to Found on the Pacific Crest Trail,46.02,In stock,3,High,Positive
"Where'd You Go, Bernadette",18.13,In stock,1,Low,Neutral
When You Are Engulfed in Flames,30.89,In stock,5,Medium,Neutral
We the People: The Modern-Day Figures Who Have Reshaped and Affirmed the Founding Fathers' Vision of America,31.95,In stock,3,Medium,Neutral
We Are All Completely Beside Ourselves,24.04,In stock,1,Medium,Positive
Walk the Edge (Thunder Road #2),32.36,In stock,3,Medium,Neutral
